[
  {"source":"mixed-directory","external_id":"alex","kind":"directory_person","occurred_at_epoch":1735689600,"author_external_id":null,"parent_external_id":null,"subjects":["person:alex"],"content_sha256":"e3b0c44298fc1c149afbf4c8996fb92427ae41e4649b934ca495991b7852b855","content":null,"metadata":{"display_name":"Alex Rivera","role_rank":4,"team_key":"team:payments"}},
  {"source":"mixed-directory","external_id":"maya","kind":"directory_person","occurred_at_epoch":1735689600,"author_external_id":null,"parent_external_id":null,"subjects":["person:maya"],"content_sha256":"e3b0c44298fc1c149afbf4c8996fb92427ae41e4649b934ca495991b7852b855","content":null,"metadata":{"display_name":"Maya Chen","role_rank":2,"team_key":"team:payments"}},
  {"source":"mixed-directory","external_id":"theo","kind":"directory_person","occurred_at_epoch":1735689600,"author_external_id":null,"parent_external_id":null,"subjects":["person:theo"],"content_sha256":"e3b0c44298fc1c149afbf4c8996fb92427ae41e4649b934ca495991b7852b855","content":null,"metadata":{"display_name":"Theo Brooks","role_rank":3,"team_key":"team:ledger"}},
  {"source":"mixed-directory","external_id":"payments-api","kind":"module","occurred_at_epoch":1735689600,"author_external_id":null,"parent_external_id":null,"subjects":["module:payments-api"],"content_sha256":"e3b0c44298fc1c149afbf4c8996fb92427ae41e4649b934ca495991b7852b855","content":null,"metadata":{"canonical_key":"module:payments-api","module_name":"payments-api"}},
  {"source":"mixed-directory","external_id":"ledger-worker","kind":"module","occurred_at_epoch":1735689600,"author_external_id":null,"parent_external_id":null,"subjects":["module:ledger-worker"],"content_sha256":"e3b0c44298fc1c149afbf4c8996fb92427ae41e4649b934ca495991b7852b855","content":null,"metadata":{"canonical_key":"module:ledger-worker","module_name":"ledger-worker"}}
]
